{
  "metadata": {
    "name": "de-mannschaftskampf-2025",
    "description": "Deutsches Regelwerk für Mannschaftskämpfe",
    "languages": ["de"],
    "author": "Deutscher Ringer-Bund"
  },
  "periodTimesInSeconds": [180, 180],
  "periodTimeCountingDirection": "Down",
  "periodBreakTimeInSeconds": 30,
  "injuryTimeWithoutBloodInSeconds": 120,
  "injuryTimeWithBloodInSeconds": 240,
  "injuryTimeCountingDirection": "Up",
  "freestyle": {
    "activityTimeInSeconds": 30,
    "activityTimeCountingDirection": "Down",
    "activityTimeCondition": {
      "passivityCount": { "gt": 1 }
    }
  },
  "victoryTypes": [
    { "type": "SS", "description": "Schultersieg", "classificationPoints": { "winner": 4, "loser": 0 } },
    {
      "type": "TÜ",
      "description": "Technische Überlegenheit",
      "classificationPoints": { "winner": 4, "loser": 0 },
      "condition": { "scoreDifference": { "gte": 15 } }
    },
    {
      "type": "PS",
      "description": "Punktsieg",
      "classificationPoints": {
        "winner": [
          [3, { "when": { "scoreDifference": { "gte": 8, "lte": 14 } } }],
          [2, { "when": { "scoreDifference": { "gte": 3, "lte": 7 } } }],
          [1, { "when": { "scoreDifference": { "gte": 1, "lte": 2 } } }],
          [1, { "when": { "award5Difference": { "gt": 0 } } }],
          [1, { "when": { "award4Difference": { "gt": 0 } } }],
          [1, { "when": { "award2Difference": { "gt": 0 } } }],
          [1, { "when": { "lastAward": { "eq": 1 } } }]
        ],
        "loser": 0
      }
    },
    { "type": "AS", "description": "Aufgabesieg", "classificationPoints": { "winner": 4, "loser": 0 } },
    { "type": "DV", "description": "Disqualifikation durch 3 Verwarnungen", "classificationPoints": { "winner": 4, "loser": 0 }, "condition": { "cautionCount": { "gte": 3 } } },
    { "type": "DQ", "description": "Disqualifikation durch unfaires Verhalten", "classificationPoints": { "winner": 4, "loser": 0 } },
    { "type": "DSQ2", "description": "Beide Ringer disqualifiziert wegen unfairem Verhalten", "classificationPoints": { "winner": 0, "loser": 0 } },
    { "type": "KL", "description": "Kampfloser Sieg", "classificationPoints": { "winner": 4, "loser": 0 } },
    { "type": "ÜG", "description": "Übergewicht", "classificationPoints": { "winner": 4, "loser": 0 } }
  ]
}
